{
  "packId": "hgp8iy3x:isv",
  "bookId": "hgp8iy3x",
  "generatedBy": "compile_pack",
  "generatedFrom": "reading-pack.md",
  "editorialStatus": "official",
  "createdAt": "2026-07-06",
  "lastReviewedAt": "2026-07-29",
  "editors": [
    "AlephBits Editorial"
  ],
  "aiAssistance": {
    "used": true,
    "tools": [],
    "humanReview": "Original human-authored demo content; this edition is a literary translation of the Polish source."
  },
  "sources": [
    {
      "type": "original",
      "description": "Original AlephBits demo content"
    }
  ],
  "revisionNotes": "Multilingual translation pilot — Interslavic edition."
}
