{
  "packId": "aeus67xo:isv",
  "bookId": "aeus67xo",
  "generatedBy": "compile_pack",
  "generatedFrom": "reading-pack.md",
  "editorialStatus": "official",
  "createdAt": "2026-10-03",
  "lastReviewedAt": "2026-10-03",
  "editors": [
    "AlephBits Editorial"
  ],
  "aiAssistance": {
    "used": true,
    "tools": [],
    "humanReview": "Text from isv-llm-lab/Zdravo/Opowiadania/interslavic; quizzes translated to Medžuslovjansky."
  },
  "sources": [
    {
      "type": "original",
      "description": "Polish canon + ISV translation"
    }
  ],
  "revisionNotes": "Collection 12–15 ISV import from isv-llm-lab Opowiadania/interslavic.",
  "translationStatus": "machine",
  "translationSource": "aeus67xo:pl",
  "translationSourceVersion": "1.0.0"
}
