{
  "packId": "l5nwqvrr:en",
  "bookId": "l5nwqvrr",
  "generatedBy": "compile_pack",
  "generatedFrom": "reading-pack.md",
  "editorialStatus": "official",
  "createdAt": "2026-07-09",
  "lastReviewedAt": "2026-07-09",
  "editors": [
    "AlephBits Editorial"
  ],
  "aiAssistance": {
    "used": true,
    "tools": [],
    "humanReview": "Migrated from Collection Three manuscript. Full text preserved — not abridged."
  },
  "sources": [
    {
      "type": "youtube",
      "videoId": "0nF74yCX2Qo"
    }
  ],
  "revisionNotes": "Tekst popularnonaukowy z silną ramą fabularną; wymaga ręcznej oceny terminologii neurologicznej i filozoficznej."
}
