{
  "packId": "b9m80o2r:isv",
  "bookId": "b9m80o2r",
  "generatedBy": "compile_pack",
  "generatedFrom": "reading-pack.md",
  "editorialStatus": "official",
  "createdAt": "2026-07-13",
  "lastReviewedAt": "2026-07-13",
  "editors": [
    "AlephBits Editorial"
  ],
  "aiAssistance": {
    "used": true,
    "tools": [],
    "humanReview": "Fikcja o współrodzicielstwie; adaptacja podcastu."
  },
  "sources": [
    {
      "type": "youtube",
      "videoId": "ewtts_glfwg"
    }
  ],
  "revisionNotes": "Phase 119 import."
}
