{
  "packId": "tvwaljze:isv",
  "bookId": "tvwaljze",
  "generatedBy": "compile_pack",
  "generatedFrom": "reading-pack.md",
  "editorialStatus": "official",
  "createdAt": "2026-07-13",
  "lastReviewedAt": "2026-07-13",
  "editors": [
    "AlephBits Editorial"
  ],
  "aiAssistance": {
    "used": true,
    "tools": [],
    "humanReview": "Fikcija, osnovana na filosofiji Jula; tema ADHD ne jestь medicinska porada."
  },
  "sources": [
    {
      "type": "youtube",
      "videoId": "Y1IvxviWkuE"
    }
  ],
  "revisionNotes": "Phase 119 import."
}
