{
  "packId": "dgnnqfkp:eo",
  "bookId": "dgnnqfkp",
  "generatedBy": "compile_pack",
  "generatedFrom": "reading-pack.md",
  "editorialStatus": "official",
  "createdAt": "2026-07-09",
  "lastReviewedAt": "2026-07-09",
  "editors": [
    "AlephBits Editorial"
  ],
  "aiAssistance": {
    "used": true,
    "tools": [],
    "humanReview": "Esperanta traduko de la pola kanona eldono (manuskripto de Collection Three). Plena teksto konservita — ne mallongigita."
  },
  "sources": [
    {
      "type": "youtube",
      "videoId": "RQ-uUuefMDY"
    }
  ],
  "revisionNotes": "Tekst ma charakter doradczy i eseistyczny; niektóre liczby oraz przykłady biznesowe warto ręcznie sprawdzić.",
  "translationStatus": "machine",
  "translationSource": "dgnnqfkp:pl",
  "translationSourceVersion": "1.0.1"
}
