{
  "packId": "ff1gxi9d:en",
  "bookId": "ff1gxi9d",
  "generatedBy": "compile_pack",
  "generatedFrom": "reading-pack.md",
  "editorialStatus": "official",
  "createdAt": "2026-07-09",
  "lastReviewedAt": "2026-07-09",
  "editors": [
    "AlephBits Editorial"
  ],
  "aiAssistance": {
    "used": true,
    "tools": [],
    "humanReview": "Migrated from Collection One manuscript. Full text preserved — not abridged."
  },
  "sources": [
    {
      "type": "youtube",
      "videoId": "FqSJn6JQR3U"
    }
  ],
  "revisionNotes": "Collection One migration (Phase 39). Trust: Manual / Reference."
}
