{
  "packId": "pe29gd8a:en",
  "bookId": "pe29gd8a",
  "generatedBy": "compile_pack",
  "generatedFrom": "reading-pack.md",
  "editorialStatus": "official",
  "createdAt": "2026-07-09",
  "lastReviewedAt": "2026-07-09",
  "editors": [
    "AlephBits Editorial"
  ],
  "aiAssistance": {
    "used": true,
    "tools": [],
    "humanReview": "Migrated from Collection Three manuscript. Full text preserved — not abridged."
  },
  "sources": [
    {
      "type": "youtube",
      "videoId": "mbEzHzDZGXs"
    },
    {
      "type": "youtube",
      "videoId": "LJ3Ca57IIOw"
    }
  ],
  "revisionNotes": "Tekst miesza fakty historyczne z reportażową narracją i zawiera fragment wymagający ręcznego sprawdzenia ciągłości redakcyjnej."
}
