{
  "packId": "polish_legenda_o_smoku_wawelskim",
  "bookId": "legenda-o-smoku-wawelskim",
  "editorialStatus": "official",
  "createdAt": "2026-07-10",
  "lastReviewedAt": "2026-07-10",
  "editors": [
    "AlephBits Editorial"
  ],
  "aiAssistance": {
    "used": false,
    "tools": [],
    "humanReview": "Migrated from CollectionZero catalog (Phase 75)."
  },
  "sources": [],
  "revisionNotes": "Phase 75 catalog migration"
}
