{
  "packId": "jknxi0pk:pl",
  "bookId": "jknxi0pk",
  "generatedBy": "compile_pack",
  "generatedFrom": "reading-pack.md",
  "editorialStatus": "official",
  "createdAt": "2026-10-01",
  "lastReviewedAt": "2026-10-01",
  "editors": [
    "AlephBits Editorial"
  ],
  "aiAssistance": {
    "used": true,
    "tools": [],
    "humanReview": "From AwesomeVault Books/13 CollectionThirteen.md."
  },
  "sources": [
    {
      "type": "youtube",
      "videoId": "1k9O45wZcUg"
    }
  ],
  "revisionNotes": "Collection Thirteen import — Polish only; quiz answers length-balanced."
}
