{
  "packId": "0a8nul02:pl",
  "bookId": "0a8nul02",
  "generatedBy": "compile_pack",
  "generatedFrom": "reading-pack.md",
  "editorialStatus": "official",
  "createdAt": "2026-10-01",
  "lastReviewedAt": "2026-10-01",
  "editors": [
    "AlephBits Editorial"
  ],
  "aiAssistance": {
    "used": true,
    "tools": [],
    "humanReview": "From AwesomeVault Books/13 CollectionThirteen.md."
  },
  "sources": [
    {
      "type": "youtube",
      "videoId": "Khwct50BlpE"
    }
  ],
  "revisionNotes": "Collection Thirteen import — Polish only; quiz answers length-balanced."
}
